{
  "$schema": "https://json-schema.org/draft/2020-12/schema",
  "$id": "https://cloud.runonflux.com/schemas/flux.deploy.schema.json",
  "title": "Flux Deployment Config",
  "type": "object",
  "additionalProperties": false,
  "required": ["version"],
  "properties": {
    "version": {
      "type": "string",
      "enum": ["1.0"],
      "description": "Schema version."
    },
    "appName": {
      "type": "string",
      "minLength": 1,
      "description": "Display name for this deployment shown in the Orbit UI."
    },
    "plan": {
      "type": "string",
      "enum": ["free", "standard", "pro", "custom"],
      "description": "Hosting plan. Choose 'custom' to specify exact resource limits. Required to be 'custom' when database or redis is configured."
    },
    "appPort": {
      "type": "integer",
      "minimum": 1,
      "maximum": 65535,
      "description": "Port the application listens on inside the container."
    },
    "outputDir": {
      "type": "string",
      "description": "Build output directory (e.g. 'dist', 'build'). Required for static site deployments."
    },
    "pollingInterval": {
      "oneOf": [
        { "type": "string", "enum": ["disabled"] },
        { "type": "integer", "enum": [3600, 7200, 21600, 43200, 86400] }
      ],
      "description": "How often (in seconds) Orbit polls for new commits. Set to 'disabled' to turn off polling."
    },
    "autoDeploy": {
      "type": "boolean",
      "description": "Automatically trigger a deploy on every push to the configured branch."
    },
    "runtime": {
      "type": "string",
      "enum": ["Node.js", "Python", "Rust", "Go", "Java", ".NET", "Bun", "Ruby", "PHP"],
      "description": "Runtime environment used to build and run the project."
    },
    "runtimeVersion": {
      "type": "string",
      "minLength": 1,
      "description": "Specific runtime version to use (e.g. '20', 'lts/*', '3.11')."
    },
    "framework": {
      "type": "string",
      "description": "Framework hint to pre-fill wizard defaults (e.g. 'nextjs', 'express', 'vite')."
    },
    "installCommand": {
      "type": "string",
      "description": "Command to install dependencies. Overrides the default (e.g. 'npm ci')."
    },
    "buildCommand": {
      "type": "string",
      "description": "Command to build the project. Overrides the default (e.g. 'npm run build')."
    },
    "runCommand": {
      "type": "string",
      "description": "Command to start the application. Overrides the default (e.g. 'node index.js')."
    },
    "prPreviewEnabled": {
      "type": "boolean",
      "description": "Spin up a preview deployment for each pull/merge request."
    },
    "envVars": {
      "type": "array",
      "description": "Environment variables injected at build and runtime.",
      "items": {
        "type": "object",
        "additionalProperties": false,
        "required": ["key", "value"],
        "properties": {
          "key": {
            "type": "string",
            "pattern": "^[A-Za-z_][A-Za-z0-9_]*$",
            "description": "Environment variable name."
          },
          "value": {
            "type": "string",
            "description": "Environment variable value."
          },
          "secret": {
            "type": "boolean",
            "default": false,
            "description": "Mark as secret — value will be masked in the UI and logs."
          }
        }
      }
    },
    "allowedLocations": {
      "type": "array",
      "description": "Whitelist of Flux location codes where the app may run.",
      "items": {
        "type": "string",
        "examples": ["acEU", "acNA_US", "acNA_US_California"]
      }
    },
    "forbiddenLocations": {
      "type": "array",
      "description": "Blacklist of Flux location codes where the app must not run.",
      "items": {
        "type": "string",
        "examples": ["a!cEU", "a!cNA_US", "a!cNA_US_California"]
      }
    },
    "continent": {
      "type": "string",
      "description": "Preferred continent for deployment (overridden by allowedLocations if both are set).",
      "examples": ["EU", "NA", "AS"]
    },
    "country": {
      "type": "string",
      "description": "Preferred country for deployment (ISO 3166-1 alpha-2).",
      "examples": ["DE", "US", "JP"]
    },
    "region": {
      "type": "string",
      "description": "Preferred sub-region for deployment."
    },
    "instances": {
      "type": "integer",
      "minimum": 1,
      "description": "Number of nodes to deploy the application across. Minimum 3 when database or redis is configured."
    },
    "cpu": {
      "type": "number",
      "exclusiveMinimum": 0,
      "description": "CPU cores allocated per application instance (e.g. 0.5, 1, 2)."
    },
    "ram": {
      "type": "integer",
      "minimum": 128,
      "description": "RAM allocated per application instance in MB (e.g. 512, 1024, 2048)."
    },
    "hdd": {
      "type": "integer",
      "minimum": 1,
      "description": "Persistent storage allocated per application instance in GB."
    },
    "database": {
      "type": "object",
      "additionalProperties": false,
      "required": ["type", "name", "cpu", "ram", "hdd"],
      "description": "Optional managed database component. Requires plan 'custom' and at least 3 application instances.",
      "properties": {
        "type": {
          "type": "string",
          "enum": ["mysql", "mariadb", "pg", "mongo"],
          "description": "Database engine type."
        },
        "name": {
          "type": "string",
          "minLength": 1,
          "description": "Database name."
        },
        "cpu": {
          "type": "number",
          "exclusiveMinimum": 0,
          "description": "CPU cores allocated per database instance (e.g. 0.5, 1, 2)."
        },
        "ram": {
          "type": "integer",
          "minimum": 128,
          "description": "RAM allocated per database instance in MB (e.g. 512, 1024, 2048)."
        },
        "hdd": {
          "type": "integer",
          "minimum": 1,
          "description": "Persistent storage allocated per database instance in GB."
        }
      }
    },
    "redis": {
      "type": "object",
      "additionalProperties": false,
      "required": ["cpu", "ram"],
      "description": "Optional managed Redis component. Requires plan 'custom' and at least 3 application instances.",
      "properties": {
        "cpu": {
          "type": "number",
          "exclusiveMinimum": 0,
          "description": "CPU cores allocated per Redis instance (e.g. 0.5, 1, 2)."
        },
        "ram": {
          "type": "integer",
          "minimum": 128,
          "description": "RAM allocated per Redis instance in MB (e.g. 512, 1024, 2048)."
        }
      }
    },
    "release": {
      "type": "object",
      "additionalProperties": false,
      "properties": {
        "include": {
          "type": "array",
          "items": { "type": "string", "minLength": 1 },
          "description": "Files or directories (relative to PROJECT_PATH) copied into the release after build packaging."
        },
        "exclude": {
          "type": "array",
          "items": { "type": "string", "minLength": 1 },
          "description": "Optional paths to omit from the release."
        }
      }
    }
  },
  "allOf": [
    {
      "if": {
        "properties": { "plan": { "const": "custom" } },
        "required": ["plan"]
      },
      "then": {
        "required": ["instances", "cpu", "ram", "hdd"]
      }
    },
    {
      "if": {
        "anyOf": [
          { "required": ["database"] },
          { "required": ["redis"] }
        ]
      },
      "then": {
        "properties": {
          "plan": { "const": "custom" },
          "instances": {
            "type": "integer",
            "minimum": 3,
            "description": "Number of nodes to deploy the application across. Minimum 3 when database or redis is configured."
          }
        },
        "required": ["plan", "instances", "cpu", "ram", "hdd"]
      }
    }
  ]
}
