{
  "version": "1.0",
  "plan": "custom",
  "appPort": 3000,
  "instances": 3,
  "cpu": 1,
  "ram": 512,
  "hdd": 10,
  "database": {
    "type": "mysql",
    "name": "nextjs_mysql",
    "cpu": 1,
    "ram": 1024,
    "hdd": 20
  },
  "release": {
    "include": [
      "prisma",
      "next.config.ts"
    ]
  }
}
